{"package":{"name":"@simulation-ontology/thermal-reference","version":"0.1.0"},"namespaces":[{"name":"thermal-ref","exports":[{"name":"ThermalConductionPhysics","kind":"entity_type","id":"https://simulation-ontology.org/id/ea6sl5xtmn"},{"name":"SteadyHeatMathModel","kind":"entity_type","id":"https://simulation-ontology.org/id/zly2cgjhi6"},{"name":"FourierConductionLaw","kind":"entity_type","id":"https://simulation-ontology.org/id/ntrfu3aazy"},{"name":"TemperatureField","kind":"entity_type","id":"https://simulation-ontology.org/id/tbevelcebb"},{"name":"ThermalConductivityProperty","kind":"entity_type","id":"https://simulation-ontology.org/id/q47ddhjosq"},{"name":"FixedTemperatureCondition","kind":"entity_type","id":"https://simulation-ontology.org/id/dxjj2gbpiu"},{"name":"thermal_conductivity_value","kind":"property","id":"https://simulation-ontology.org/id/lyw3ihoott"},{"name":"prescribed_temperature","kind":"property","id":"https://simulation-ontology.org/id/wsoh3uq6on"},{"name":"thermal_conductivity_dimension","kind":"constraint_definition","id":"https://simulation-ontology.org/id/bnl7x6f3fi"},{"name":"temperature_dimension","kind":"constraint_definition","id":"https://simulation-ontology.org/id/3wnkbzk3s2"},{"name":"ThermalConductivityValueInterface","kind":"interface","id":"https://simulation-ontology.org/id/zddcfjurim"},{"name":"PrescribedTemperatureInterface","kind":"interface","id":"https://simulation-ontology.org/id/zuz4hb7nxt"}]}],"resolved_dependencies":[{"package":"@simulation-ontology/core-reference-fixture","version":"0.1.0"}],"entity_types":[{"id":"https://simulation-ontology.org/id/ea6sl5xtmn","is_a":"https://simulation-ontology.org/id/yc27f2rmbe"},{"id":"https://simulation-ontology.org/id/zly2cgjhi6","is_a":"https://simulation-ontology.org/id/xypnl2wocu"},{"id":"https://simulation-ontology.org/id/ntrfu3aazy","is_a":"https://simulation-ontology.org/id/36sc7q6sgh"},{"id":"https://simulation-ontology.org/id/tbevelcebb","is_a":"https://simulation-ontology.org/id/zp6ffdj7ng"},{"id":"https://simulation-ontology.org/id/q47ddhjosq","is_a":"https://simulation-ontology.org/id/mwzzr2dlsv"},{"id":"https://simulation-ontology.org/id/dxjj2gbpiu","is_a":"https://simulation-ontology.org/id/2jxteabydt"}],"properties":[{"id":"https://simulation-ontology.org/id/lyw3ihoott"},{"id":"https://simulation-ontology.org/id/wsoh3uq6on"}],"relations":[],"constraint_definitions":[{"id":"https://simulation-ontology.org/id/bnl7x6f3fi","payload":{"type":"dimension","vector":{"time":-3,"length":1,"mass":1,"electric_current":0,"thermodynamic_temperature":-1,"amount_of_substance":0,"luminous_intensity":0}},"interface_application_target_kinds":["property_requirement"]},{"id":"https://simulation-ontology.org/id/3wnkbzk3s2","payload":{"type":"dimension","vector":{"time":0,"length":0,"mass":0,"electric_current":0,"thermodynamic_temperature":1,"amount_of_substance":0,"luminous_intensity":0}},"interface_application_target_kinds":["property_requirement"]}],"interfaces":[{"id":"https://simulation-ontology.org/id/zddcfjurim","extends":[],"property_requirements":[{"property":"https://simulation-ontology.org/id/lyw3ihoott"}],"relation_requirements":[],"constraint_applications":[{"constraint":"https://simulation-ontology.org/id/bnl7x6f3fi","target":{"kind":"property_requirement","requirement":"https://simulation-ontology.org/id/lyw3ihoott"}}]},{"id":"https://simulation-ontology.org/id/zuz4hb7nxt","extends":[],"property_requirements":[{"property":"https://simulation-ontology.org/id/wsoh3uq6on"}],"relation_requirements":[],"constraint_applications":[{"constraint":"https://simulation-ontology.org/id/3wnkbzk3s2","target":{"kind":"property_requirement","requirement":"https://simulation-ontology.org/id/wsoh3uq6on"}}]}],"interface_implementations":[{"entity_type":"https://simulation-ontology.org/id/q47ddhjosq","interface":"https://simulation-ontology.org/id/zddcfjurim","property_mappings":[{"requirement":"https://simulation-ontology.org/id/lyw3ihoott","concrete":"https://simulation-ontology.org/id/lyw3ihoott"}],"relation_mappings":[]},{"entity_type":"https://simulation-ontology.org/id/dxjj2gbpiu","interface":"https://simulation-ontology.org/id/zuz4hb7nxt","property_mappings":[{"requirement":"https://simulation-ontology.org/id/wsoh3uq6on","concrete":"https://simulation-ontology.org/id/wsoh3uq6on"}],"relation_mappings":[]}]}