{"package":{"name":"@simulation-ontology/plasma-reference","version":"0.1.0"},"namespaces":[{"name":"plasma-ref","exports":[{"name":"PlasmaPhysics","kind":"entity_type","id":"https://simulation-ontology.org/id/eq6dhpk4dm"},{"name":"Reaction","kind":"entity_type","id":"https://simulation-ontology.org/id/ybsmw3k3hd"},{"name":"DissociativeAttachmentReaction","kind":"entity_type","id":"https://simulation-ontology.org/id/4xhmdsg7j3"},{"name":"ElectronSpecies","kind":"entity_type","id":"https://simulation-ontology.org/id/3arobejact"},{"name":"NeutralSpecies","kind":"entity_type","id":"https://simulation-ontology.org/id/6uiiaqiob4"},{"name":"NegativeIonSpecies","kind":"entity_type","id":"https://simulation-ontology.org/id/3ejtoo6p4n"},{"name":"Cl2Species","kind":"entity_type","id":"https://simulation-ontology.org/id/j3ijlmlobp"},{"name":"ClAtomSpecies","kind":"entity_type","id":"https://simulation-ontology.org/id/pdqv5bjaq4"},{"name":"ClMinusSpecies","kind":"entity_type","id":"https://simulation-ontology.org/id/yyoyushsmg"},{"name":"reactants","kind":"relation","id":"https://simulation-ontology.org/id/is3q43nx2u"},{"name":"products","kind":"relation","id":"https://simulation-ontology.org/id/o7hkersiye"},{"name":"qrc_one_negative_ion_product","kind":"constraint_definition","id":"https://simulation-ontology.org/id/gvta6gvuoj"},{"name":"qrc_one_neutral_product","kind":"constraint_definition","id":"https://simulation-ontology.org/id/3a7vxafn2k"},{"name":"DissociativeAttachmentProductContract","kind":"interface","id":"https://simulation-ontology.org/id/3d5732lnb3"}]}],"resolved_dependencies":[{"package":"@simulation-ontology/core-reference-fixture","version":"0.1.0"}],"entity_types":[{"id":"https://simulation-ontology.org/id/eq6dhpk4dm","is_a":"https://simulation-ontology.org/id/yc27f2rmbe"},{"id":"https://simulation-ontology.org/id/ybsmw3k3hd","is_a":"https://simulation-ontology.org/id/2dy5m7736k"},{"id":"https://simulation-ontology.org/id/4xhmdsg7j3","is_a":"https://simulation-ontology.org/id/ybsmw3k3hd"},{"id":"https://simulation-ontology.org/id/3arobejact","is_a":"https://simulation-ontology.org/id/zrbefujchf"},{"id":"https://simulation-ontology.org/id/6uiiaqiob4","is_a":"https://simulation-ontology.org/id/zrbefujchf"},{"id":"https://simulation-ontology.org/id/3ejtoo6p4n","is_a":"https://simulation-ontology.org/id/zrbefujchf"},{"id":"https://simulation-ontology.org/id/j3ijlmlobp","is_a":"https://simulation-ontology.org/id/6uiiaqiob4"},{"id":"https://simulation-ontology.org/id/pdqv5bjaq4","is_a":"https://simulation-ontology.org/id/6uiiaqiob4"},{"id":"https://simulation-ontology.org/id/yyoyushsmg","is_a":"https://simulation-ontology.org/id/3ejtoo6p4n"}],"properties":[],"relations":[{"id":"https://simulation-ontology.org/id/is3q43nx2u","endpoint_contract":{"kind":"typed","matching":"canonical_type_or_subtype","domain":["https://simulation-ontology.org/id/ybsmw3k3hd"],"range":["https://simulation-ontology.org/id/zrbefujchf"]}},{"id":"https://simulation-ontology.org/id/o7hkersiye","endpoint_contract":{"kind":"typed","matching":"canonical_type_or_subtype","domain":["https://simulation-ontology.org/id/ybsmw3k3hd"],"range":["https://simulation-ontology.org/id/zrbefujchf"]}}],"constraint_definitions":[{"id":"https://simulation-ontology.org/id/gvta6gvuoj","payload":{"type":"cardinality","relation":"https://simulation-ontology.org/id/o7hkersiye","direction":"source","qualifier":{"target_type":"https://simulation-ontology.org/id/3ejtoo6p4n"},"min":1,"max":1},"interface_application_target_kinds":["relation_requirement"]},{"id":"https://simulation-ontology.org/id/3a7vxafn2k","payload":{"type":"cardinality","relation":"https://simulation-ontology.org/id/o7hkersiye","direction":"source","qualifier":{"target_type":"https://simulation-ontology.org/id/6uiiaqiob4"},"min":1,"max":1},"interface_application_target_kinds":["relation_requirement"]}],"interfaces":[{"id":"https://simulation-ontology.org/id/3d5732lnb3","extends":[],"property_requirements":[],"relation_requirements":[{"relation":"https://simulation-ontology.org/id/o7hkersiye"}],"constraint_applications":[{"constraint":"https://simulation-ontology.org/id/gvta6gvuoj","target":{"kind":"relation_requirement","requirement":"https://simulation-ontology.org/id/o7hkersiye"}},{"constraint":"https://simulation-ontology.org/id/3a7vxafn2k","target":{"kind":"relation_requirement","requirement":"https://simulation-ontology.org/id/o7hkersiye"}}]}],"interface_implementations":[{"entity_type":"https://simulation-ontology.org/id/4xhmdsg7j3","interface":"https://simulation-ontology.org/id/3d5732lnb3","property_mappings":[],"relation_mappings":[{"requirement":"https://simulation-ontology.org/id/o7hkersiye","concrete":"https://simulation-ontology.org/id/o7hkersiye"}]}]}